"3";"The aim of this study was to analyse incidence and efficacy of revisional surgery for failed vertical banded gastroplasty among 458 patients who underwent primary surgery between 1993 and 2003. Staple line disruption was diagnosed in 29 patients and was an indication for restoration of gastroplasty in 10 cases and a conversion to Roux-en-Y gastric bypass in 19 patients. In two cases of outlet stenosis the band was exchanged to enlarge the collar. In two cases of psychological intolerance of restriction the band was removed because of refusion by patients the conversion to Roux-en-Y gastric bypass. A substantial weight reduction without statistical differences between restoration and conversion group was recognized. In two patients (20%) after restoration and three patients (15.8%) after conversion we observed weight regain (p=0.57). In cases with removed band weight regained up to its value recorded before surgery. In patients with exchanged band weight was under control. No serious complications were observed. We could conclude that patients with weight regain after vertical banded gastroplasty should be offered conversion to Roux-en-Y gastric bypass. When malabsorption is refused, restoration of vertical banded gastroplasty could be also performed. Both of procedures are technically difficult but safe."
"3";"Outcomes of bariatric surgery have been linked to institutional case volume. The objective of our study was to compare outcome of laparoscopic Roux-en-y gastric bypass (RYGB) in 2 settings: a low-volume Veterans Affairs (VA) and a high-volume university hospital (UH). Over a period of 27 months, 140 patients underwent RYGB (137 laparoscopic, 3 open) performed by 1 surgeon. Fifty-five were performed at a VA and 85 at a UH with an annual caseload close to 300. The body mass index in both groups was similar, but patients at the VA were older, mostly men, and more likely to have hypertension (HTN), obstructive sleep apnea, and diabetes mellitus (DM). Operative and anesthesia times were significantly longer at the VA. There were no differences in 30-day mortality (none), major morbidity, conversion rates, or reoperation rates. Laparoscopic RYGB can be performed safely at a VA facility despite a higher risk population and low annual volume."
"3";"Several endocrine abnormalities are reported in obesity. Some are considered as causative factors, whereas others are considered to be secondary effects of obesity. In the current study, we explored the changes in cortisol, growth hormone (GH), DHEA, DHEA-S and GH releasing hormone (ghrelin) plasma levels in morbidly obese subjects who lost abundant weight following laparoscopic adjustable gastric banding (LAGB). 12 morbidly obese adult patients (15 females), age 21-56 years with BMI 46.0+/-4.4 kg/cm(2), were studied. Blood samples were collected before, 6 and 14 months after LAGB. The levels of DHEA, DHEA-S, cortisol, GH, and ghrelin were determined by commercial kits. Statistical analysis was based on one-way repeated measures ANOVA, followed by Student-Newman-Keuls post-hoc test. Mean BMI reduced significantly along the study course (P=.000). Cortisol plasma levels significantly decreased 6 months after surgery (from 541.4+/-242.4 nM to 382.4+/-142.1 nM, P=.004), but did not change further after 14 months (460.2+/-244.9 nM), despite further reduction in BMI (P=.050). GH constantly increased throughout the study from 0.076+/-0.149 ng/ml, to 0.410+/-0.509 ng/ml at 6 months (NS), to 1.224+/-1.738 ng/ml at 14 months after surgery (P=.001). DHEA, DHEA-S and ghrelin plasma levels remained stable throughout the study. GH levels showed a persistent increase during the 14 months following LAGB in association with the weight loss, while a transient decrease in cortisol levels occurred at the 6-months time-point. In contrast, ghrelin, DHEA and DHEA-S were not altered after surgery. The association between GH and cortisol secretion and surgical- and nonsurgical-induced weight reduction merits further investigation."
"3";"Laparoscopic Roux-en-Y gastric bypass (LRYGBP) is associated with a significant learning curve. We hypothesize that differences in surgeon and assistant training backgrounds may significantly impact outcomes during the learning curve. Retrospective analysis was performed on patients undergoing LRYGBP at an academic medical center between January 1998 and August 2003. Operations were performed by surgeons with different training backgrounds: without formal laparoscopic fellowship (S1, n=95); immediately following laparoscopic fellowship (S2, n=100); and with extensive laparoscopic experience post fellowship (S3, n=88). First assistants were attendings, fellows, or residents. The variables analyzed included demographics, operative times, estimated blood loss (EBL), rate of conversion, length of stay (LOS), ICU stay, re-operation/re-admission rate, and complications. Results were analyzed by ANOVA and Fisher's exact test. There were significant differences among surgeons of different training backgrounds in EBL, LOS, rate of ICU admission, and intraoperative and late complications rates. Among assistants of different training levels, there were significant differences in operative time, EBL, intraoperative complication rates and re-admission rates. Differences in training background of the surgeons resulted in significant differences in outcome, including EBL, LOS, ICU admission and intraoperative and late complication rates. Lower assistant training levels significantly impacted efficiency through lengthened operative times and increased EBL, as well as increased intraoperative complication rates and re-admission rates. Our results suggested that participating in a laparoscopic fellowship and operating with a more experienced assistant may improve outcomes during the learning curve."
"3";"This study aimed to determine whether advanced age or sex was predictive of adverse outcomes after Roux-en-Y gastric bypass. The Pennsylvania State Discharge Database was searched for records of morbidly obese patients who underwent Roux-en-Y gastric bypass. The SASs MIXED Procedure was used to test whether mortality alone or adverse outcomes (postoperative complications, nonroutine hospital transfer and mortality) were significantly related to sex or advanced age (>50 years). The presence of comorbidities was used as a blocking variable. Between 1999 and 2001, 4,685 patients underwent Roux-en-Y gastric bypass in Pennsylvania, of which 82% were female and 20% were older than 50 years of age. Comorbidities were present in 71% of patients. Twenty-eight deaths (0.6%) and 813 adverse outcomes (17.4%) occurred. Mortality was greater in males than in females (1.2% vs. 0.47%, P<0.05) without comorbid interaction. Mortality did not increase with age. Adverse outcomes were related to both sexes (24% male, 16% female, P<0.05) and age (< or = 50, 16% vs. > 50, 23%, P<0.05) with a small comorbid interaction. Adverse outcomes are more frequent among males and older patients and are influenced by comorbidities. Male patients have a higher mortality that was not affected by the presence of comorbidities."
"3";"Enhanced insulin sensitivity is commonly seen following Roux-en-Y gastric bypass surgery (RYGB) whereas symptomatic hypoglycemia post-RYGB seems to occur infrequently. It is unclear how different plasma glucose and insulin responses are in patients with symptomatic hypoglycemia (SX-RYGB) versus those who remain asymptomatic (ASX-RYGB), nor when compared with non-surgical controls with varying degrees of insulin sensitivity. Plasma glucose and insulin concentrations were determined following a 75-g oral glucose challenge in five groups: symptomatic and asymptomatic patients following RYGB (n = 9 each) and overweight/obese controls, divided into three subgroups (n = 30 each) on the basis of degree of insulin sensitivity measured by the insulin suppression test. SX-RYGB group had higher 30-min glucose after oral glucose compared with the ASX-RYGB group (p = 0.04). The two groups did not differ in peak glucose and insulin concentrations, nadir glucose concentration, or insulin-to-glucose ratio 30 min after oral glucose. These values were significantly different from the three control groups, and peak insulin concentrations post-RYGB were increased at every degree of insulin sensitivity as compared with the control groups. Plasma glucose and insulin responses to oral glucose in patients with symptomatic hypoglycemia post-RYGB are minimally different when compared to individuals who remain asymptomatic, and both groups demonstrate hyperinsulinemia out of proportion to their degree of insulin sensitivity."
"3";"Bariatric surgery can result in massive, rapid weight loss. Patients who undergo this surgery can be left with significant facial and neck skin redundancy and may request restorative facial plastic surgery. Optimal results require a thorough understanding of the unique physiologic, metabolic, and anatomic findings in these patients. Modifications of standard rhytidectomy techniques are necessary to suit the specific features of the patient after bariatric surgery."
"3";"The authors evaluated the predictive efficacy of preoperative resting energy expenditure (REE) on long-term weight loss maintenance following vertical banded gastroplasty (VBG). In the long-term following VBG, low energy expenditure could lead to regain of weight, and thereby REE data might be a reliable predictor of long-term weight outcomes. A prospective study was conducted, taking into account the relationship between preoperative REE values and the results at 3 and 5 years following VBG in terms of both weight loss and success of the operation. Long-term weight loss and outcome following VBG appeared to be completely independent of the preoperative REE. Preoperative REE cannot predict long-term weight outcome following VBG."
"3";"Roux-en-Y gastric bypass (RYGBP) is well tolerated and effective in ameliorating diseases common to morbidly obese patients. A potential drawback, however, is the risk for stomal ulcers, probably due to acid and peptic digestion of the mucosa in the proximal Roux limb. In 23 RYGBP patients (mean BMI 45 kg/m(2), age 39 years), the gastro-jejunostomy was performed by circular stapler and the gastric suture ring retrieved for histological examination. 13 consecutive patients received our standard totally transected 4 x 3 cm proximal gastric pouch. The anvil was passed transgastricly and reference biopsies were taken from the gastrotomy in the corpus of the stomach. In the last 10 patients, the pouch size was reduced to 2 x 3 cm by a modified surgical technique. All suture rings from the standard pouches consisted of corpus-fundus mucosa with a large amount of parietal cells, histologically identical to the reference biopsies from the gastrotomy. Also, the 10 suture rings from the modified small pouches contained corpus-fundus mucosa. In 5 of these samples, cardiac mucosa was found, but only in a small segment (6 mm). In addition, 3 patients had esophageal epithelium in the suture ring. The proximal pouch invariably contains acid-producing parietal cells. In order to reduce acid production and, hence, the risk of stomal ulcers, the pouch has to be made as small as possible."
"3";"2 cases of proteinuria in obese non-diabetic young males, both corresponding to focal segmental glomerulosclerosis are presented. Effective reduction of body weight by bariatric surgery was followed by sustained remission of proteinuria allowing significant reduction or total removal of blockers of the reninangiotensin- system."
"3";"Gastric bypass has repeatedly been shown to improve and even cure type 2 diabetes by substantially improving insulin resistance. The mechanism by which it achieves this is not currently known, but some have hypothesized that there may be important humoral effects brought about by the bypass of the stomach, duodenum or proximal jejunum. A better understanding of the time course of the changes in insulin resistance after surgery might assist our understanding of potential mechanisms. Intravenous glucose tolerance tests (IVGTT) were performed in 26 severely obese patients on the morning of gastric bypass surgery and again 6 days later. In addition insulin resistance was assessed in 71 patients undergoing gastric bypass surgery by the homeostasis model assessment (HOMA) method before surgery, and again at 6 days, 3, 6, 9, and 12 months. Patients were divided into 3 groups for analysis: diabetics, impaired glucose tolerance and normal glucose tolerance. All 3 groups of patients were noted to have insulin resistance prior to surgery. This was greatest in the diabetic patients, as indicated by HOMA. There was marked loss of/improvement in insulin resistance within 6 days of gastric bypass by both IVGTT and HOMA methods in all groups, which was maintained over the 12-month period. The study included 31 diabetic patients, of whom only 3 required medication following hospital discharge. The changes in insulin resistance seen after gastric bypass, which are responsible for the resolution or improvement of type 2 diabetes occur within 6 days of the surgery, before any appreciable weight loss has occurred. This finding has implications for our understanding of the mechanism of insulin resistance in severely obese patients and is consistent with a humoral mechanism emanating from the GI tract."
"3";"Postoperative leaks after laparoscopic Roux-en-Y gastric bypass (LRYGB) are a source of morbidity and mortality. Any intervention that would decrease leak rates after LRYGB would be useful. This investigation tested the hypothesis that postoperative leak rates are lower after LRYGB with the routine use of intraoperative endoscopy (EN). Consecutive patients who underwent LRYGB were included. Intraoperative leak testing with air and methylene blue through an orogastric tube (OG) was used in the first 200 patients. Intraoperative endoscopy was used after the first 200 patients. There were 400 patients in this study. Preoperative demographics did not differ between groups. The intraoperative leak rate of the EN group was double the OG group (8 vs 4%; P = not significant), although the difference was not statistically significant. The OG group had a postoperative leak rate of 4 per cent with a mortality rate of 1 per cent. The EN group had a postoperative leak rate of 0.5 per cent with a mortality rate of 0 per cent. The difference in leak rates was statistically significant (P < 0.04). Despite the issues of learning curve, EN demonstrates more intraoperative leaks than OG, indicating EN may be a more sensitive test than OG. Routine use of EN is associated with less postoperative leaks after LRYGB."
"3";"Morbid obesity (MO) has reached epidemic proportions and is a major health problem in developed nations. In the adolescent with MO, early intervention can minimize obesity-related comorbidities, avoid premature mortality, improve quality of life, and prevent obesity-related diseases as these patients mature into adulthood. The primary surgical treatment of adolescent patients meeting National Institutes of Health criteria for bariatric surgery has been the gastric bypass (GB). Although GB has led to weight loss and improvement of comorbid conditions, concerns remain over the high incidence of postoperative complications and life-style-altering long-term sequelae of gastrointestinal tract reconstruction. Based on the excellent results from international adult series as well as the authors' own experience of more than 300 adult patients, laparoscopic adjustable gastric banding (LAGB) as an alternative to GB to eligible adolescents was offered. After medical, psychologic, and nutritional screening, 4 patients (ages 17-19 years) with a body mass index of 40 or more (range, 40-61) who failed medical attempts at weight loss were selected for LAGB. The operative time was 40 to 90 minutes. All patients were discharged on the day of surgery. There were no early complications. One patient had cholecystitis 6 months after surgery requiring laparoscopic cholecystectomy. For the 4 patients, the amount of excess weight loss was 57% at 30 months, 34% at 12 months, 87% at 7 months, and 15% at 4 months, respectively. In this preliminary series of the US experience in the use of LAGB for the management of adolescents with MO, the lack of operative morbidity, short operative time/hospital stay, and encouraging initial weight loss mirror the adult experience and illustrate that the LAGB is a safe and effective alternative to GB. These encouraging results support further evaluation of LAGB as a surgical option in a comprehensive adolescent weight loss program."
"3";"The important weight loss due to bariatric surgery allows to improve and even correct, a great part of the comorbidities induced by obesity, as well as quality of life, and to reduce the coming out of cardiovascular and metabolic diseases in operated patients. The impact of surgical treatment on the patient's health and quality of life also allows to reduce direct and indirect costs of morbid obesity. However, its effects on mortality have not yet been clearly proved. The preoperative evaluation and the long term follow-up by a skilled team are essential to reduce potential complications, especially on the nutritional field and the risks of recovered weight linked to binge eating disorders."
"3";"Impaired blood pressure (BP) variation, often found in obesity and hypertension, is associated with increased cardiovascular risk. The effect of obesity surgery on BP variation is unknown. We performed this study to investigate the effect of gastric bypass surgery on circadian BP variation in morbidly obese hypertensive subjects. The study group consisted of eight patients (mean age 35.0 +/- 9.1 years), with impaired circadian BP rhythm. Controls were eight well-matched subjects (34.6 +/- 9.8 years) with normal BP rhythm. All patients underwent gastric bypass surgery. The 24-h ambulatory BP measurements were performed before (baseline) and 8 weeks after gastric bypass surgery. Mean body weight in the study group and controls decreased from baseline of 129.0 +/- 21.9 kg and 134.1 +/- 27.2 kg to 116.7 +/- 21.1 kg (by 9.5% +/- 2.1%) and 121.6 +/- 25.7 kg (by 9.3% +/- 1.7%) after the surgery, respectively (P < .0001 v baseline). Mean 24-h, daytime, and night-time BP values decreased significantly and similarly in both groups. In the study group mean 24-h systolic and diastolic BP decreased from 154.7 +/- 12.3 mm Hg and 105.6 +/- 8.1 mm Hg to 138.5 +/- 9.3 mm Hg and 90.8 +/- 6.7 mm Hg and in controls from 158.2 +/- 16.5 mm Hg and 106.2 +/- 10.0 mm Hg to 136.3 +/- 10.8 mm Hg and 92.9 +/- 6.3 mm Hg (P < .0001 v baseline), respectively. Circadian BP rhythm in the study group returned to the normal profile (mean systolic nocturnal fall increased from 4.0% +/- 2.4% to 16.4% +/- 4.0% and diastolic, from 5.1% +/- 3.0% to 17.3% +/- 5.5%; P < .0001 v baseline), whereas it remained normal in the controls. Surgery-induced body weight loss in morbidly obese hypertensive subjects with impaired circadian BP variation is not only associated with BP reduction, but also with the restoration of normal BP rhythm."
"3";"To compare the prevalence of effort-related calf pain in an obese and a general population and to analyze the incidence of and recovery from such pain after surgical and conventional obesity treatment. A random sample of 1135 subjects from a general population was compared with 6328 obese subjects in the Swedish Obese Subjects study. Obese subjects were followed longitudinally, and information about calf pain was obtained from surgically and conventionally treated patients for up to 6 years. In both sexes, self-reported calf pain was more common in the obese than in the general population [odds ratios (ORs) 5.0 and 4.0 in men and women, respectively, p<0.001]. Obese patients undergoing surgery had a lower 6-year incidence of calf pain compared with the conventionally treated control group (ORs 0.39 and 0.61, p<0.05). Among subjects reporting symptoms at baseline, the 6-year recovery rate was higher in the surgical group compared with the control group (ORs 15.3 and 5.9, p<0.001). Obese subjects have markedly more problems with effort-related calf pain than the general population. Surgical obesity treatment reduces the long-term risk of developing claudication symptoms and increases the likelihood of recovering from such symptoms."
"3";"We report an uncommon case of a life-threatening abdominal wall hematoma after liposuction. One day after liposuction surgery, the patient experienced syncope and low blood pressure. Enhanced computed tomography (CT) demonstrated an extravasation in an abdominal wall hematoma. Transcatheter embolization was done successfully, without complication. Life-threatening complications caused by abdominal wall hematomas after liposuction are very rare. There have been few reports in the literature of life-threatening hemorrhagic complications after liposuction that were treated by transcatheter embolization."
"3";"The One Anastomosis Gastric Bypass has been developed from the Mini Gastric Bypass procedure as originally described by Robert Rutledge. The modification of the original procedure consists of making a latero-lateral gastro-jejunal anastomosis instead of a termino-lateral anastomosis, as is carried out as described in the original procedure. The rationale for these changes is to try to reduce exposure of the gastric mucosa to biliopancreatic secretions because of their potentially carcinogenic effects with longer term exposure, which is the major criticism of the original technique. If we fix the jejunal loop to the gastric pouch some centimetres up to the gastro-jejunal anastomosis the biliopancreatic secretions have less possibility of coming into the gastric cavity (gravity force). Furthermore, if the anastomosis is latero-lateral this possibility is reduced even more. In addition, the intestinal loop reinforces the staple line against disruption, and also the gastric pouch against dilatation."
"3";"The level of serum leptin was studied in 20 patients before and after liposuction carried out for excessive subcutaneous fatty tissue. The dynamics of indices depending on the volume of the ablated fatty tissue was analyzed. It was found that in most patients the level of blood serum leptin correlated with the body mass and fatty tissue index. A removal of limited volumes of fatty tissue results in the elevated level of blood serum leptin. The aspiration of great volume of fatty tissue is followed by the primary decrease of the leptin level which further reaches the initial level and even surpasses it."
"3";"Iron absorption is decreased in some individuals who have undergone bariatric surgery. We evaluated measures of iron metabolism and therapeutic phlebotomy in 3 adults with hemochromatosis and HFE C282Y homozygosity who underwent bariatric surgery. 1 male and 1 female had surgery before diagnosis of hemochromatosis (jejuno-ileal bypass and Roux-en-Y gastric bypass, respectively); neither had iron overload. Another man was treated with serial phlebotomy to induce iron depletion; later, he underwent Roux-en-Y gastric bypass. His maintenance phlebotomy requirement for hemochromatosis decreased substantially (on average approximately 1 unit each 71 days before surgery, and approximately 1 unit each 173 days after surgery). None of these patients developed iron deficiency, and none took supplemental iron. Iron absorption is decreased in some patients with hemochromatosis and HFE C282Y homozygosity after bariatric surgery, but their risk of developing iron deficiency may be diminished."
"3";"Roux-en-Y gastric bypass is the most commonly performed bariatric operation in the USA. Anastomotic leak is one of the devastating complications in this operation. By using fibrin sealant around the anastomosis, surgeons can achieve better hemostasis around the suture-line and prevent or decrease the incidence of anastomotic leaks. This paper discusses the biological and clinical evidence for use of fibrin sealant in laparoscopic gastric bypass."
"3";"Gastrointestinal hemorrhage is a potential perioperative complication after Roux-en-Y gastric bypass. The surgeon performing laparoscopic gastric bypass should understand the need for early recognition and management of this complication, as it can be life-threatening. This paper discusses the incidence and clinical presentation of gastrointestinal hemorrhage, mechanisms for hemorrhage, management options, and possible methods of prevention."
