"2";"Wound-healing complications following body contouring for massive weight loss patients are significant, with rates exceeding 40 percent. To better understand aberrant healing in this population, the authors have performed a comparative analysis of the wound milieu literature for patient populations with similar complication rates. PubMed and Ovid databases were reviewed from January of 1985 to January of 2009 for key terms, including wound healing, obesity, cancer, burn, transplant, and body contouring. Serum and wound levels of multiple factors, including matrix metalloproteinases (MMPs) and cytokines, were assessed. Complication rates in body contouring surgery range from 31 to 66 percent. Sixty-five studies were reviewed, and wound-healing complication rates were identified for cancer (45.8 percent), burn (30.4 percent), posttransplant (36 percent), and obese (43 percent) populations. In these groups, matrix metalloproteinases and tissue inhibitors of metalloproteinase (TIMPs) help regulate wound repair. Matrix metalloproteinase levels were elevated in cancer (4-fold increase in MMP-2), burn (20- to 30-fold increase in MMP-9), transplant (1.4-fold increase in MMP-2), and obese/chronic (79-fold increase) populations. TIMPs were increased in cancer (1.9-fold increase in TIMP-2) and burn (1.4-fold increase in TIMP-1) patients but decreased in chronic wound (55-fold decrease in TIMP-1) populations. Alterations to these regulatory proteins lead to prolonged matrix degradation, up-regulation of inflammatory mediators, and decreased growth factors, delaying the wound-healing process. Complications after body contouring surgery are likely multifactorial; however, molecular imbalances to the massive weight loss wound milieu may contribute to poor surgical outcomes. Examining wound regulatory proteins including transforming growth factor-beta, vascular endothelial growth factor, and matrix metalloproteinases could aid in understanding the healing difficulties observed clinically."
"3";"Laparoscopic adjustable gastric banding is growing in popularity in the United States. A rare late complication is obstruction at the level of the band, with concentric gastric pouch dilation. In our patient, endoscopy showed gastric pouch dilation with food impaction and a restricted outlet. We describe the combined endoscopic and laparoscopic approach for alleviation of chronic obstruction as a late complication of an adjustable gastric band. This combined approach included laparoscopic band removal and scar excision with intraoperative endoscopic dilation."
"2";"Obesity is a problem that is reaching epidemic proportions throughout the world and bariatric surgery is now a rapidly growing technique. However existence of obesity in humans has been recognized for thousands of years, as statues dating from the Stone Age period appear to provide the earliest depictions. Hippocrates (466-355 b.C.) and Galen (131-201 a.C.) had a clear understanding of the condition, its consequences and medical treatment. On the other hand bariatric surgery was a xx century treatment, but at the end of the xix century it was known that the massive loss of small bowel or gastric resection after ulcer surgery resulted in persistent weight loss. Malabsorption and gastric restriction in isolation, or more commonly in combination, remain the main options to surgical control of weight. Unfortunately surgery as a non etiological treatment is an imperfect model to treat an incurable disease: morbid obesity. Prevention and better knowledge of disease would allow a tailored medical or surgical approach."
"3";"Management of patients with total intestinal aganglionosis (TIA) is a medical challenge because of their dependency on parenteral nutrition (PN). Intestinal transplantation (ITx) represents the only alternative treatment for patients with irreversible intestinal failure for achieving intestinal autonomy. Among 66 patients who underwent ITx in our center, 12 had TIA. They received either isolated ITx (n = 4) or liver-ITx (LITx, n = 8) after 10 to 144 months of total PN. All grafts included the right colon. After a median follow-up of 57 months, the survival rate was 62.5% in the LITx group and 100% in the ITx patients. The graft survival rate was 62.5% in the LITx group and 75% in the ITx group. All the surviving patients were fully weaned from total PN, after a median of 57 days. Pull through of the colon allograft was carried out in all patients. Fecal continence is normal in all but one of the surviving children. These results suggest that ITx with colon grafting should be the preferred therapeutic option in TIA. Early referral to a transplantation center after diagnosis of TIA is critical to prevent PN-related cirrhosis and thereby to permit ITx, which is associated with a good survival rate."
"3";"There is a growing need for clinically applicable body composition assessment tools for extremely obese individuals. The objective of this research was to evaluate several bioimpedance techniques for monitoring changes in fluid, particularly intracellular water (reflecting body cell mass) after bariatric surgery. Fifteen extremely obese women (body mass index: 48.9+/-7.0 kg/m(2); age: 48+/-9 years) were assessed before (baseline; T1), and approximately 6 weeks after gastric bypass surgery (T2) by several multifrequency bioelectrical impedance analysis approaches (MFBIA; QuadScan 4000), a bioimpedance spectroscopy device (BIS; Hydra 4200), and multiple dilution. BIS provided intracellular water estimates that were comparable to criterion, based on mean comparisons, at both time points (T1: criterion: 24.2+/-3.1L, BIS: 24.0+/-3.7 L; T2: criterion: 20.6+/-3.7 L, BIS: 19.7+/-3.2L). MFBIA (with Deurenberg equations) provided comparable measures to criterion only at T2 (criterion: 20.3+/-3.7L, MFBIA: 20.6+/-2.7 L). Both MFBIA (with QuadScan proprietary equations) and BIS produced estimates of intracellular water change that were comparable to dilution. There was substantial variability in individual volume measures. Although MFBIA and BIS hold promise as convenient techniques for assessing fluid changes, individual variability in measurements makes them impractical for assessment of extremely obese patients in the clinical setting."
"3";"To compare and describe the weight loss outcomes from gastric bypass and gastric band so as to define the variation of excess weight loss (EWL) among individual patients, the time to onset of effect, and the durability of weight loss in severely obese adults. Gastric bypass and gastric band are the most common operations for obesity performed in the United States, but few reports have compared these 2 procedures. Patients (N = 1733, aged 18-65 years) met National Institutes of Health criteria for obesity surgery and underwent either gastric bypass or gastric band between March 1997 and November 2006. The selection of bypass versus band was based on patient/surgeon discussion. The evaluable sample consisted of 1518 patients. The percentage of EWL was assessed over 2 years. Successful weight loss was defined a priori as > or = 40% EWL in each of four 6-month postoperative measurement periods. The analyses included a mixed model and generalized estimating equation (GEE) model with repeated measures. Odds ratios and descriptive analyses were also provided. Gastric bypass was associated with less individual variation in weight loss than gastric band. Both procedures were associated with a significant EWL benefit (Treatment Group effect P < 0.0001), but they differed in terms of time to effect (Treatment Group x Period interaction effect P < 0.0001). The mean EWL for gastric bypass was greater at each measurement period (6, 12, 18, 24 months) compared with gastric band (P < 0.0001). Furthermore, at each of the postoperative measurement periods within each treatment group (bypass and band), the mean EWL was greater for those who had preoperative body mass index (BMI) < or = 50 kg/m2 than for those who had preoperative BMI > 50 kg/m2 (P < 0.0001). Gastric bypass was consistently associated with a greater likelihood of at least a 40% EWL in each of the 6-month postoperative measurement periods (GEE, P < 0.0001). The odds ratio estimates at months 6, 12, 18, and 24 were 18.2, 20.6, 15.5, and 9.1, respectively. Despite these clinically meaningful outcome differences, nearly all (> or = 93%) bypass and band patients who had > or = 40% EWL at 6, 12, or 18 months postoperatively maintained at least this level of success at 2 years. Gastric bypass produced more rapid, greater, and more consistent EWL across individuals over a 2-year postoperative period than gastric band."
"3";"Many different remedial operations for alkaline reflux gastritis have been described. Analysis of their efficacy is difficult, because while many of the procedures have good early results, there are long-term failures due to their own complications. The aim of this study is to evaluate our experience with patients undergoing remedial operations for alkaline reflux gastritis syndrome. The clinical features and results of remedial operations of 65 patients with alkaline reflux gastritis syndrome were reviewed retrospectively. Data on the hospital course were collected by interviewing patients directly or by telephone contact. An assessment of each patient's response to remedial operation was then made and a Visick score assigned. All patients had been tried on a medical treatment and dietary restriction or both prior to remedial operation. Long-term follow up was possible in 46 patients. Seventy-six percent of patients who at the final state had a truncal vagotomy, distal gestrectomy and Roux-en-Y gastrojejunostomy have been found to show satisfactory results (Visick-I/Visick II). Three patients who had previously undergone a Roux-en-Y conversion later required re-operation for Roux-stasis syndrome and a near-total gastrectomy was performed on these patients. Other operations performed for alkaline reflux gastritis were converted to ""uncut"" Roux-en-Y in five patients and dismantling of gastrojejunostomy in two patients. For patients unresponsive to medical treatment, we reccommend the following strategy: a) for patients with truncal vagotomy plus gastrojejunostomy, dismantling of gastrojejunostomy should be the first choice b) for patients with prior Billroth-II gastrectomy, Roux-en-Y conversion is the most effective corrective operation, although it has its proper including Roux statis syndrome."
"3";"The primary objective of this study was to assess the validity of body mass index (BMI) in predicting percent body fat and changes in percent body fat with weight loss in bariatric surgery patients. Twenty-two bariatric patients (17 female, five male) began the study designed to include 12 months of testing, including data collection within 1 week presurgery and 1 month, 3 months, 6 months, and 1 year postsurgery. Five female subjects were lost to the study between 6 months and 12 months postsurgery, resulting in 17 subjects (12 female, five male) completing the 12 months of testing. Variables measured in the study included height, weight, percent fat (% fat) by hydrostatic weighing, lean mass, fat mass, and basal metabolic rate. Regression analyses predicting % fat from BMI yielded the following results: presurgery r = 0.173, p = 0.479, standard error of estimate (SEE) = 3.86; 1 month r = 0.468, p = 0.043, SEE = 4.70; 3 months r = 0.553, p = 0.014, SEE = 6.2; 6 months r = 0.611, p = 0.005, SEE = 5.88; 12 months r = 0.596, p = 0.007, SEE = 7.13. Regression analyses predicting change in % fat from change in BMI produced the following results: presurgery to 1 month r = -0.134, p = 0.583, SEE = 2.44%; 1-3 months r = 0.265, p = 0.272, SEE = 2.36%; 3-6 months r = 0.206, p = 0.398, SEE = 3.75%; 6-12 months r = 0.784, p = 0.000, SEE = 3.20. Although some analyses resulted in significant correlation coefficients (p < 0.05), the relatively large SEE values would preclude the use of BMI in predicting % fat or change in % fat with weight loss in bariatric surgery patients."
"3";"We report a rare case of acute early postoperative small bowel obstruction after laparoscopic Roux-en-Y gastric bypass due to an intraluminal blood clot at the site of the jejuno-jejunostomy. Patient was treated successfully with enterotomy and removal of the clot. A review of literature showed three similar publications."
"3";"Lipoinjection is a promising treatment, but its efficacy in recontouring facial lipoatrophy remains to be established. The objective was to evaluate the efficacy and adverse effects of lipoinjection and supplementation of adipose-derived stem/stromal cells (ASCs) to adipose grafts. To overcome drawbacks of autologous lipoinjection, we have developed a novel strategy called cell-assisted lipotransfer (CAL). In CAL, stromal vascular fraction containing ASCs was freshly isolated from half of an aspirated fat sample and attached to the other half of aspirated fat sample with the fat acting as a scaffold. This process converts relatively ASC-poor aspirated fat into ASC-rich fat. We performed conventional lipoinjection (non-CAL; n=3) or CAL (n=3) on six patients with facial lipoatrophy due to lupus profundus or Parry-Romberg syndrome. All patients obtained improvement in facial contour, but the CAL group had a better clinical improvement score than did the non-CAL patients, although the difference did not reach statistical significance (p=.11). Adipose necrosis was found in one non-CAL case who took perioperative oral corticosteroids. Our results suggest that CAL is both effective and safe and potentially superior to conventional lipoinjection for facial recontouring. The authors have indicated no significant interest with commercial supporters."
"3";"Laparoscopic gastric banding and Roux-en-Y gastric bypass are widely used for the treatment of morbid obesity. The impact of these two procedures on health-related quality of life has not been analyzed in comparative studies. A matched-pair analysis of a prospectively collected database was performed. Fifty-two consecutive patients with laparoscopic gastric bypass were randomly matched to fifty-two patients with laparoscopic gastric banding according to age, BMI, and gender. Quality of life was assessed using two standardized questionnaires (SF 36 and Moorehead-Ardelt II). Mean preoperative BMI was 45.7 kg/m(2) for the bypass patients and 45.3 kg/m(2) for the banding patients. Mean BMI after 3 years follow-up of was 30.4 kg/m(2) and 33.1 kg/m(2) (p=0.036). In the SF 36 questionnaire, gastric bypass patients yielded a mean total score of 613 versus 607 points in the gastric banding group (p=0.543), which is comparable to the normal population in Europe. In the Moorhead-Ardelt II questionnaire, the gastric bypass patients scored a mean total of 1.35 points and the gastric banding patients 1.28 points (p=0.747). Of the patients, 97% with a gastric bypass and 83% with a gastric banding were satisfied with the result of the operation (p=0.145). The patients after laparoscopic gastric bypass and laparoscopic gastric banding have a high level of satisfaction 3 years after the operation and have similar quality of life scores compared to the normal population. Quality of life indexes were not different between the two procedures and were independent of weight loss in successfully operated patients."
"3";"To determine the long-term efficacy and safety of a low-pressure adjustable gastric band in the treatment for morbid obesity and to detect whether age, gender, or preoperative body mass index (BMI) has an impact on the outcome. It is well known that low-pressure adjustable gastric bands such as the Swedish adjustable gastric bands (SAGB) lead to weight loss. However, very few long-term studies have been published and questions remain regarding long-term efficacy and safety, and whether any of the patient's demographic parameters including age, gender, or initial BMI impact the long-term outcome. Six hundred consecutive patients who had a SAGB inserted between August 1996 and October 2005 were evaluated with regard to their initial BMI, age, and sex. There were 488 females and 112 males, with mean age 45.3 +/- 9.1, mean BMI 42.9 +/- 7.2 kg/m2, and mean weight 119.6 +/- 23.9 kg. Overall morbidity was 25.7% (10.4% perioperative, whereas 15.3% on long term). The following data represents 2, 3, 5, and 7 years of follow-up respectively. Mean BMI decreased to 30.9, 30.5, 32.7, and 31.2 kg/m2, whereas mean percentage excess weight loss (%EWL) was 60.5%, 61.5%, 53.2%, and 61.2%. Patients with BMI (<40 kg/m2) lost 63.7%, 61.2%, 45.5%, and 66.1% of their excess weight, whereas patients with BMI (40-49.9 kg/m2) lost 60.1%, 61.3%, 59.4%, and 66.6%, patients with BMI (50-50.9 kg/m2) lost 57.5%, 67.5%, 49.3%, and 40.2%, and patients with BMI (>60 kg/m2) lost 42.2%, 46.3%, 38.7%, and 40.2%. Female patients %EWL were 62.2%, 62.1%, 55.1%, and 62.3%, whereas male %EWL were 54.1%, 59.1%, 42.1%, and 51.3%. Patients <40 years %EWL were 61.8%, 62.5%, 57.1%, and 86.2%, whereas >40 years %EWL were 60.1%, 61.2%, 52.4%, and 60.1%. The SAGB is effective in achieving long-term sustainable weight loss with an acceptably low complication rate. Bands are effective regardless of patients' age and gender. Furthermore, preoperative BMI up to 60 kg/m2 does not influence the outcome."
"3";"The aim of this study was to define a standardized technique for laparoscopic sleeve gastrectomy in the morbidly obese patient. There are several surgical options for the morbidy obese patient. In general, there are the restrictive procedures [e.g., laparoscopic adjustable gastric banding (LAGB)] and the malabsorptive procedures [e.g. laparoscopic Roux-en-Y gastric bypass (LRYGBP)]. Those techniques are already standardized. The laparoscopic sleeve gastrectomy (LSG) seems to have some advantages over both procedures, but it is not standardized yet, and so there can be no comparison between the different techniques. In our center we have standardized the LSG technique with respect to abdominal access and narrowness of the gastric sleeve. After dissection of the greater omentum and the short gastric vessels, the greater curvature is resected along a 34-Fr gastric tube using the Endo-GIA. The remaining gastric sleeve has a volume of about 100 ml. The standardized LSG procedure is presented step by step. A comparison of operative data and early outcome with a matched group of patients with adjustable gastric banding showed no difference between the two techniques with respect to operating time, surgical complications, and weight loss 6 months after surgery. With our standardized LSG technique it is possible to evaluate the positive aspects of the LSG compared with other standardized bariatric procedures like LAGB or LRYGBP."
"3";"We evaluated the efficacy of malabsorptive bariatric surgery on daily blood glucose fluctuations and oxidative stress in type 2 diabetic obese patients. The 48-h continuous subcutaneous glucose monitoring was assessed in type 2 diabetic patients before and 1 month after biliopancreatic diversion (BPD) (n = 36), or after diet-induced equivalent weight loss (n = 20). The mean amplitude of glycemic excursions and oxidative stress (nitrotyrosine) were evaluated during continuous subcutaneous glucose monitoring. During a standardized meal, glucagon-like peptide (GLP)-1, glucagon, and insulin were measured. Fasting and postprandial glucose decreased equally in surgical and diet groups. A marked increase in GLP-1 occurred during the interprandial period in surgical patients toward the diet group (P < 0.01). Glucagon was more suppressed during the interprandial period in surgical patients compared with the diet group (P < 0.01). Mean amplitude of glycemic excursions and nitrotyrosine levels decreased more after BPD than after diet (P < 0.01). Oxidative stress reduction after biliopancreatic diversion seems to be related to the regulation of glucose fluctuations resulting from intestinal bypass."
"3";"Duodenal localization of Crohn's disease is rare, accounting for only 0.5-4% of all cases. Most common complaints are gastric outlet obstruction and weight loss. Histologic findings of endoscopic biopsy are frequently not definitive, making differentiation from other, benign structures complicated. There are also no standard guidelines regarding indications for surgical management. We reviewed the cases of three surgically managed patients with duodenal Crohn's disease at the 1st Department of Surgery, Semmelweis University of Medicine, Budapest, during a 5-year period (2002-2007). All three patients had persistent symptoms of stomach emptying disorder despite medical therapy and had severe weight loss (13-30 kg). In two cases resection of the stenotic duodenum was performed successfully using Billroth II method. Gastro-jejunal bypass was performed in one case, where the descendent duodenum was inflamed. All patients have been asymptomatic since surgery (9-45 months of follow-up) and recovered their earlier bodyweight. The postoperative period was uneventful. There is indication of surgery in cases of stenosing duodenal Crohn's disease, when medical therapy is not successful, but long-standing malnutrition should be treated preoperatively. We found perioperative morbidity to be similar in patients with duodenal Crohn's and in those with Crohn's disease of other intestinal locations."
"3";"Several studies have suggested that morbid obesity is associated with vitamin D deficiency and elevated parathyroid hormone (PTH). Studies have also suggested that there is an increase in vitamin D deficiency, bone resorption, and elevated PTH after gastric bypass surgery. Few studies have evaluated markers of bone and calcium metabolism after laparoscopic adjustable gastric banding or compared these results to those after gastric bypass. Data on all patients undergoing primary gastric bypass (GBP; n = 979) and laparoscopic adjustable gastric banding (LAGB; n = 269) procedures at a tertiary-referral center from June 1996 through March 2005 were reviewed from a prospective database. Only patients with 25OH vitamin D levels available were included in this study (n = 534; GBP = 403, LAGB = 131). All patients were advised to take at least 1,200 mg calcium and 800-1,200 IU of vitamin D daily before and subsequent to their operation. Markers for bone metabolism [25OH Vitamin D, corrected serum calcium, alkaline phosphatase (AP), and PTH] were evaluated preoperatively and 3, 6, 12, and 24 months postoperatively. An analysis of variance and chi-square were performed to determine differences between the operative groups. Linear regression analysis was performed to evaluate the relationship between preoperative body mass index (BMI) and 25OH vitamin D and PTH levels and between percent excess weight loss and 25OH vitamin D and PTH after surgery. Sixty-four percent of all patients presented with vitamin D deficiency (<20 ng/ml) and 14% presented with elevated PTH preoperatively. Mean 25OH vitamin D levels and AP levels increased significantly after GBP surgery (vitamin D, 17 to 25 ng/ml 12 months post-op; AP, 80 to 90 IU/L 24 months post-op). Corrected calcium levels remained within normal limits and showed no change over time after both procedures. AP levels significantly increased from 76 IU/l preoperatively to 82 IU/l 6 months after LAGB surgery and then decreased to 59 IU/l 24 months after LAGB surgery. Linear regression analysis of preoperative vitamin D, PTH, and BMI values showed a significant positive relationship between initial BMI and PTH (r = 0.29) and a significant negative relationship between vitamin D and initial BMI (r = -0.19). A significant positive linear relationship between vitamin D and percent excess weight loss was evident 12 and 24 months after GBP surgery (r = 0.39 and 0.57, respectively). A negative relationship was evident between PTH and vitamin D 6 months after GBP surgery (r = -0.35) and 12 months after LAGB surgery (r = -0.61). These findings suggest that morbid obesity is associated with vitamin D deficiency, and elevated PTH and with adequate supplementation, GBP, and particularly LAGB, patients can improve their bone metabolism abnormalities related to obesity. Furthermore, adequate supplementation for GBP patients may attenuate the increased risk for bone loss associated with malabsorption from the bypass."
